text,category
Naive Bayes is a simple yet effective algorithm.,Machine Learning
It is often used in text classification tasks.,Machine Learning
Python is a popular programming language for data science.,Programming
Data preprocessing is an important step in machine learning pipelines.,Machine Learning
Scikit-learn provides a wide range of machine learning algorithms,Machine Learning
Deep learning models require a large amount of data for training.,Machine Learning
Matplotlib and Seaborn are libraries used for data visualization,Data Visualization
NLP stands for Natural Language Processing,Machine Learning
Linear regression is a basic technique for regression analysis.,Machine Learning
Decision trees are interpretable machine learning models.,Machine Learning
Web scraping is used to extract data from websites.,Programming
Support Vector Machines (SVM) are effective for classification tasks.,Machine Learning
K-means clustering is an unsupervised learning algorithm.,Machine Learning
Neural networks are computational models inspired by the human brain.,Machine Learning
Data analysis involves exploring and understanding datasets.,Data Analysis
Random forests are an ensemble learning technique.,Machine Learning
